{
  "iso3": "VEN",
  "country_name": "Venezuela",
  "country_aliases": [
    "Venezuela",
    "Venezuela, RB"
  ],
  "status": "draft",
  "reviewer": null,
  "reviewed_on": null,
  "review_due": null,
  "dossier_path": "countries/VEN/candidates/2026.10.27.remediated/dossier.md",
  "evidence_ids": [
    "VEN-E-101",
    "VEN-E-102",
    "VEN-E-103",
    "VEN-E-108",
    "VEN-E-109",
    "VEN-E-111",
    "VEN-E-112",
    "VEN-E-113",
    "VEN-E-114",
    "VEN-E-115",
    "VEN-E-116",
    "VEN-E-117",
    "VEN-E-118",
    "VEN-E-119"
  ],
  "pathway_ids": [],
  "decision_notes": "Unapproved depth extension. Prior snapshots and inherited evidence deadlines are preserved. Coordinator decisions are not designated human approval."
}
