{
  "iso3": "KAZ",
  "country_name": "Kazakhstan",
  "country_aliases": [],
  "status": "draft",
  "reviewer": null,
  "reviewed_on": null,
  "review_due": null,
  "dossier_path": "countries/KAZ/candidates/2026.10.27.remediated/dossier.md",
  "evidence_ids": [
    "KAZ-E-101",
    "KAZ-E-102",
    "KAZ-E-103",
    "KAZ-E-104",
    "KAZ-E-105",
    "KAZ-E-106",
    "KAZ-E-107",
    "KAZ-E-108",
    "KAZ-E-110",
    "KAZ-E-111",
    "KAZ-E-113",
    "KAZ-E-114"
  ],
  "pathway_ids": [
    "KAZ-P-101"
  ],
  "decision_notes": "Unapproved depth extension. Prior snapshots and inherited evidence deadlines are preserved. Coordinator decisions are not designated human approval."
}
