{
  "iso3": "TJK",
  "country_name": "Tajikistan",
  "country_aliases": [],
  "status": "draft",
  "reviewer": null,
  "reviewed_on": null,
  "review_due": null,
  "dossier_path": "countries/TJK/candidates/2026.10.27.remediated/dossier.md",
  "evidence_ids": [
    "TJK-E-001",
    "TJK-E-002",
    "TJK-E-003",
    "TJK-E-004",
    "TJK-E-005",
    "TJK-E-006",
    "TJK-E-007",
    "TJK-E-008",
    "TJK-E-101",
    "TJK-E-102",
    "TJK-E-103",
    "TJK-E-104",
    "TJK-E-105",
    "TJK-E-106",
    "TJK-E-107",
    "TJK-E-108",
    "TJK-E-109",
    "TJK-E-110",
    "TJK-E-111",
    "TJK-E-112"
  ],
  "pathway_ids": [
    "TJK-P-101"
  ],
  "decision_notes": "Unapproved depth extension. Prior snapshots and inherited evidence deadlines are preserved. Coordinator decisions are not designated human approval."
}
