{
  "iso3": "LBY",
  "country_name": "Libya",
  "country_aliases": [],
  "status": "approved",
  "reviewer": "Lindsey Jones",
  "reviewed_on": "2026-10-27",
  "review_due": "2027-08-13",
  "dossier_path": "countries/LBY/approved/2026.10.27/dossier.md",
  "evidence_ids": [
    "LBY-E-001",
    "LBY-E-002",
    "LBY-E-003",
    "LBY-E-004",
    "LBY-E-005",
    "LBY-E-006",
    "LBY-E-007",
    "LBY-E-008",
    "LBY-E-009",
    "LBY-E-010",
    "LBY-E-011",
    "LBY-E-012",
    "LBY-E-013",
    "LBY-E-014",
    "LBY-E-015",
    "LBY-E-016",
    "LBY-E-017",
    "LBY-E-018",
    "LBY-E-019",
    "LBY-E-020",
    "LBY-E-021",
    "LBY-E-022",
    "LBY-E-023",
    "LBY-E-024",
    "LBY-E-025",
    "LBY-E-101",
    "LBY-E-102",
    "LBY-E-103",
    "LBY-E-104",
    "LBY-E-105",
    "LBY-E-106",
    "LBY-E-107",
    "LBY-E-108"
  ],
  "pathway_ids": [
    "LBY-P-001",
    "LBY-P-002",
    "LBY-P-003",
    "LBY-P-004",
    "LBY-P-005",
    "LBY-P-006",
    "LBY-P-007",
    "LBY-P-008"
  ],
  "decision_notes": "Unapproved depth extension. Prior snapshots and inherited evidence deadlines are preserved. Coordinator decisions are not designated human approval.\n\nPrior draft notes are historical. Approved by Lindsey Jones on 2026-10-27 for qualified routine/default Climate-FCV application use. This is release-use approval, not independent verification or certification of claims or sources. Existing uncertainty, source-access limits and individual evidence review deadlines remain in force. See reviews/20261027_global-production-approval-manifest.json."
}
