{
  "iso3": "URY",
  "country_name": "Uruguay",
  "country_aliases": [],
  "status": "approved",
  "reviewer": "Lindsey Jones",
  "reviewed_on": "2026-10-27",
  "review_due": "2027-10-27",
  "dossier_path": "countries/URY/approved/2026.10.27/dossier.md",
  "evidence_ids": [
    "URY-E-101",
    "URY-E-102",
    "URY-E-103",
    "URY-E-104",
    "URY-E-105",
    "URY-E-106",
    "URY-E-107",
    "URY-E-108",
    "URY-E-109",
    "URY-E-110",
    "URY-E-111",
    "URY-E-112",
    "URY-E-113",
    "URY-E-114",
    "URY-E-115"
  ],
  "pathway_ids": [],
  "decision_notes": "Unapproved depth extension. Prior snapshots and inherited evidence deadlines are preserved. Coordinator decisions are not designated human approval.\n\nPrior draft notes are historical. Approved by Lindsey Jones on 2026-10-27 for qualified routine/default Climate-FCV application use. This is release-use approval, not independent verification or certification of claims or sources. Existing uncertainty, source-access limits and individual evidence review deadlines remain in force. See reviews/20261027_global-production-approval-manifest.json."
}
