{
  "iso3": "ZMB",
  "country_name": "Zambia",
  "country_aliases": [],
  "status": "draft",
  "reviewer": null,
  "reviewed_on": null,
  "review_due": null,
  "dossier_path": "countries/ZMB/candidates/2026.10.27.remediated/dossier.md",
  "evidence_ids": [
    "ZMB-E-001",
    "ZMB-E-002",
    "ZMB-E-003",
    "ZMB-E-004",
    "ZMB-E-005",
    "ZMB-E-006",
    "ZMB-E-101",
    "ZMB-E-103",
    "ZMB-E-104",
    "ZMB-E-105",
    "ZMB-E-106",
    "ZMB-E-107",
    "ZMB-E-108",
    "ZMB-E-109",
    "ZMB-E-110",
    "ZMB-E-111",
    "ZMB-E-112",
    "ZMB-E-113"
  ],
  "pathway_ids": [],
  "decision_notes": "Unapproved depth extension. Prior snapshots and inherited evidence deadlines are preserved. Coordinator decisions are not designated human approval."
}
