{
  "iso3": "HND",
  "country_name": "Honduras",
  "country_aliases": [],
  "status": "draft",
  "reviewer": null,
  "reviewed_on": null,
  "review_due": null,
  "dossier_path": "countries/HND/candidates/2026.10.27.remediated/dossier.md",
  "evidence_ids": [
    "HND-E-001",
    "HND-E-002",
    "HND-E-003",
    "HND-E-004",
    "HND-E-005",
    "HND-E-006",
    "HND-E-007",
    "HND-E-101",
    "HND-E-102",
    "HND-E-103",
    "HND-E-104",
    "HND-E-105",
    "HND-E-106",
    "HND-E-107",
    "HND-E-108",
    "HND-E-109",
    "HND-E-110",
    "HND-E-111"
  ],
  "pathway_ids": [
    "HND-P-001",
    "HND-P-101"
  ],
  "decision_notes": "Unapproved depth extension. Prior snapshots and inherited evidence deadlines are preserved. Coordinator decisions are not designated human approval."
}
