{
  "iso3": "AGO",
  "country_name": "Angola",
  "country_aliases": [],
  "status": "draft",
  "reviewer": null,
  "reviewed_on": null,
  "review_due": null,
  "dossier_path": "countries/AGO/candidates/2026.10.26.deep/dossier.md",
  "evidence_ids": [
    "AGO-E-101",
    "AGO-E-102",
    "AGO-E-103",
    "AGO-E-104",
    "AGO-E-105",
    "AGO-E-106",
    "AGO-E-107",
    "AGO-E-108",
    "AGO-E-109",
    "AGO-E-110",
    "AGO-E-111",
    "AGO-E-112",
    "AGO-E-113",
    "AGO-E-114",
    "AGO-E-115",
    "AGO-E-116",
    "AGO-E-117"
  ],
  "pathway_ids": [
    "AGO-P-101"
  ],
  "decision_notes": "Unapproved depth extension. Prior snapshots and inherited evidence deadlines are preserved. Coordinator decisions are not designated human approval."
}
