{
  "iso3": "GRD",
  "country_name": "Grenada",
  "country_aliases": [],
  "status": "draft",
  "reviewer": null,
  "reviewed_on": null,
  "review_due": null,
  "dossier_path": "countries/GRD/candidates/2026.10.27.remediated/dossier.md",
  "evidence_ids": [
    "GRD-E-001",
    "GRD-E-002",
    "GRD-E-003",
    "GRD-E-004",
    "GRD-E-005",
    "GRD-E-006",
    "GRD-E-101",
    "GRD-E-102",
    "GRD-E-103",
    "GRD-E-104",
    "GRD-E-105",
    "GRD-E-106",
    "GRD-E-107",
    "GRD-E-108",
    "GRD-E-109",
    "GRD-E-110",
    "GRD-E-111",
    "GRD-E-112"
  ],
  "pathway_ids": [],
  "decision_notes": "Unapproved depth extension. Prior snapshots and inherited evidence deadlines are preserved. Coordinator decisions are not designated human approval."
}
