{
  "iso3": "BDI",
  "country_name": "Burundi",
  "country_aliases": [],
  "status": "draft",
  "reviewer": null,
  "reviewed_on": null,
  "review_due": null,
  "dossier_path": "countries/BDI/candidates/2026.10.27.remediated/dossier.md",
  "evidence_ids": [
    "BDI-E-001",
    "BDI-E-002",
    "BDI-E-003",
    "BDI-E-004",
    "BDI-E-005",
    "BDI-E-006",
    "BDI-E-102",
    "BDI-E-103",
    "BDI-E-104",
    "BDI-E-105",
    "BDI-E-106",
    "BDI-E-107",
    "BDI-E-108"
  ],
  "pathway_ids": [
    "BDI-P-001"
  ],
  "decision_notes": "Unapproved depth extension. Prior snapshots and inherited evidence deadlines are preserved. Coordinator decisions are not designated human approval."
}
