{
  "iso3": "EGY",
  "country_name": "Egypt",
  "country_aliases": [
    "Arab Republic of Egypt",
    "Egypt",
    "Egypt, Arab Rep.",
    "Egypt, Arab Republic of"
  ],
  "status": "draft",
  "reviewer": null,
  "reviewed_on": null,
  "review_due": null,
  "dossier_path": "countries/EGY/candidates/2026.10.26.deep/dossier.md",
  "evidence_ids": [
    "EGY-E-101",
    "EGY-E-102",
    "EGY-E-103",
    "EGY-E-104",
    "EGY-E-105",
    "EGY-E-106",
    "EGY-E-107",
    "EGY-E-108",
    "EGY-E-109"
  ],
  "pathway_ids": [],
  "decision_notes": "Unapproved depth extension. Prior snapshots and inherited evidence deadlines are preserved. Coordinator decisions are not designated human approval."
}
