{
  "iso3": "IRN",
  "country_name": "Iran",
  "country_aliases": [],
  "status": "draft",
  "reviewer": null,
  "reviewed_on": null,
  "review_due": null,
  "dossier_path": "countries/IRN/candidates/2026.10.27.remediated/dossier.md",
  "evidence_ids": [
    "IRN-E-001",
    "IRN-E-002",
    "IRN-E-003",
    "IRN-E-004",
    "IRN-E-005",
    "IRN-E-006",
    "IRN-E-009",
    "IRN-E-010",
    "IRN-E-011",
    "IRN-E-012",
    "IRN-E-013",
    "IRN-E-014",
    "IRN-E-015",
    "IRN-E-016",
    "IRN-E-017",
    "IRN-E-018",
    "IRN-E-019",
    "IRN-E-020",
    "IRN-E-021",
    "IRN-E-022",
    "IRN-E-105",
    "IRN-E-106",
    "IRN-E-107",
    "IRN-E-108",
    "IRN-E-109",
    "IRN-E-110",
    "IRN-E-111"
  ],
  "pathway_ids": [
    "IRN-P-001",
    "IRN-P-002",
    "IRN-P-003",
    "IRN-P-004",
    "IRN-P-005",
    "IRN-P-006",
    "IRN-P-007",
    "IRN-P-008"
  ],
  "decision_notes": "Unapproved depth extension. Prior snapshots and inherited evidence deadlines are preserved. Coordinator decisions are not designated human approval."
}
