{
  "iso3": "BLR",
  "country_name": "Belarus",
  "country_aliases": [],
  "status": "draft",
  "reviewer": null,
  "reviewed_on": null,
  "review_due": null,
  "dossier_path": "countries/BLR/candidates/2026.10.27.remediated/dossier.md",
  "evidence_ids": [
    "BLR-E-102",
    "BLR-E-103",
    "BLR-E-104",
    "BLR-E-105",
    "BLR-E-106",
    "BLR-E-107",
    "BLR-E-108",
    "BLR-E-109",
    "BLR-E-110",
    "BLR-E-111",
    "BLR-E-112"
  ],
  "pathway_ids": [],
  "decision_notes": "Unapproved depth extension. Prior snapshots and inherited evidence deadlines are preserved. Coordinator decisions are not designated human approval."
}
