{
  "iso3": "GIN",
  "country_name": "Guinea",
  "country_aliases": [],
  "status": "draft",
  "reviewer": null,
  "reviewed_on": null,
  "review_due": null,
  "dossier_path": "countries/GIN/candidates/2026.10.27.remediated/dossier.md",
  "evidence_ids": [
    "GIN-E-001",
    "GIN-E-002",
    "GIN-E-003",
    "GIN-E-004",
    "GIN-E-005",
    "GIN-E-006",
    "GIN-E-007",
    "GIN-E-101",
    "GIN-E-102",
    "GIN-E-103",
    "GIN-E-104",
    "GIN-E-105",
    "GIN-E-106",
    "GIN-E-107",
    "GIN-E-108",
    "GIN-E-109",
    "GIN-E-110"
  ],
  "pathway_ids": [],
  "decision_notes": "Unapproved depth extension. Prior snapshots and inherited evidence deadlines are preserved. Coordinator decisions are not designated human approval."
}
