{
  "iso3": "NER",
  "country_name": "Niger",
  "country_aliases": [],
  "status": "draft",
  "reviewer": null,
  "reviewed_on": null,
  "review_due": "2027-08-13",
  "dossier_path": "countries/NER/candidates/2026.10.26/dossier.md",
  "evidence_ids": [
    "NER-E-001",
    "NER-E-002",
    "NER-E-003",
    "NER-E-004",
    "NER-E-005",
    "NER-E-006",
    "NER-E-008",
    "NER-E-009",
    "NER-E-010",
    "NER-E-011",
    "NER-E-012",
    "NER-E-013",
    "NER-E-014",
    "NER-E-015",
    "NER-E-016",
    "NER-E-017",
    "NER-E-018",
    "NER-E-020",
    "NER-E-021",
    "NER-E-025",
    "NER-E-026",
    "NER-E-027",
    "NER-E-028",
    "NER-E-029",
    "NER-E-030"
  ],
  "pathway_ids": [
    "NER-P-001",
    "NER-P-003",
    "NER-P-004",
    "NER-P-005",
    "NER-P-006",
    "NER-P-007",
    "NER-P-008"
  ],
  "decision_notes": "Automated source review completed 26 October 2026; pending human approval. Five records were deferred where primary passages were not inspected. Rolling FAO records were refreshed to the 28 August 2026 edition, and the Niger field-study source was corrected to the official USAID PDF. No source PDFs are included."
}
