{
  "iso3": "SSD",
  "country_name": "Synthetic South Sudan Pilot",
  "country_aliases": ["Synthetic SSD"],
  "status": "draft",
  "reviewer": null,
  "reviewed_on": null,
  "review_due": null,
  "dossier_path": "countries/SSD/dossier.md",
  "evidence_ids": ["SSD-E-001", "SSD-E-002"],
  "pathway_ids": ["SSD-P-001"],
  "decision_notes": "Synthetic draft review record for deterministic validation tests."
}
