{
  "iso3": "ATG",
  "country_name": "Antigua and Barbuda",
  "country_aliases": [],
  "status": "approved",
  "reviewer": "Lindsey Jones",
  "reviewed_on": "2026-10-27",
  "review_due": "2027-10-27",
  "dossier_path": "countries/ATG/approved/2026.10.27/dossier.md",
  "evidence_ids": [
    "ATG-E-101",
    "ATG-E-102",
    "ATG-E-103",
    "ATG-E-104",
    "ATG-E-105",
    "ATG-E-106",
    "ATG-E-107",
    "ATG-E-108",
    "ATG-E-109",
    "ATG-E-110",
    "ATG-E-111",
    "ATG-E-112",
    "ATG-E-113",
    "ATG-E-114",
    "ATG-E-115"
  ],
  "pathway_ids": [
    "ATG-P-101"
  ],
  "decision_notes": "Unapproved depth extension. Prior snapshots and inherited evidence deadlines are preserved. Coordinator decisions are not designated human approval.\n\nPrior draft notes are historical. Approved by Lindsey Jones on 2026-10-27 for qualified routine/default Climate-FCV application use. This is release-use approval, not independent verification or certification of claims or sources. Existing uncertainty, source-access limits and individual evidence review deadlines remain in force. See reviews/20261027_global-production-approval-manifest.json."
}
