{
  "iso3": "CAF",
  "country_name": "Central African Republic",
  "country_aliases": [],
  "status": "draft",
  "reviewer": null,
  "reviewed_on": null,
  "review_due": null,
  "dossier_path": "countries/CAF/candidates/2026.10.27.remediated/dossier.md",
  "evidence_ids": [
    "CAF-E-001",
    "CAF-E-002",
    "CAF-E-003",
    "CAF-E-004",
    "CAF-E-005",
    "CAF-E-006",
    "CAF-E-007",
    "CAF-E-008",
    "CAF-E-009",
    "CAF-E-010",
    "CAF-E-011",
    "CAF-E-012",
    "CAF-E-015",
    "CAF-E-016",
    "CAF-E-017",
    "CAF-E-018",
    "CAF-E-019",
    "CAF-E-020",
    "CAF-E-101",
    "CAF-E-102",
    "CAF-E-103",
    "CAF-E-104",
    "CAF-E-105",
    "CAF-E-106",
    "CAF-E-107"
  ],
  "pathway_ids": [
    "CAF-P-001",
    "CAF-P-002",
    "CAF-P-003",
    "CAF-P-005",
    "CAF-P-006",
    "CAF-P-008"
  ],
  "decision_notes": "Unapproved depth extension. Prior snapshots and inherited evidence deadlines are preserved. Coordinator decisions are not designated human approval."
}
