{
  "iso3": "UGA",
  "country_name": "Uganda",
  "country_aliases": [],
  "status": "draft",
  "reviewer": null,
  "reviewed_on": null,
  "review_due": null,
  "dossier_path": "countries/UGA/candidates/2026.10.27.remediated/dossier.md",
  "evidence_ids": [
    "UGA-E-001",
    "UGA-E-002",
    "UGA-E-003",
    "UGA-E-004",
    "UGA-E-005",
    "UGA-E-006",
    "UGA-E-101",
    "UGA-E-102",
    "UGA-E-103",
    "UGA-E-104",
    "UGA-E-105",
    "UGA-E-106",
    "UGA-E-107",
    "UGA-E-108",
    "UGA-E-109",
    "UGA-E-110"
  ],
  "pathway_ids": [
    "UGA-P-101"
  ],
  "decision_notes": "Unapproved depth extension. Prior snapshots and inherited evidence deadlines are preserved. Coordinator decisions are not designated human approval."
}
