{
  "iso3": "SLB",
  "country_name": "Solomon Islands",
  "country_aliases": [],
  "status": "approved",
  "reviewer": "Lindsey Jones",
  "reviewed_on": "2026-10-27",
  "review_due": "2027-10-26",
  "dossier_path": "countries/SLB/approved/2026.10.27/dossier.md",
  "evidence_ids": [
    "SLB-E-001",
    "SLB-E-002",
    "SLB-E-003",
    "SLB-E-004",
    "SLB-E-005",
    "SLB-E-006",
    "SLB-E-007",
    "SLB-E-101",
    "SLB-E-102",
    "SLB-E-103",
    "SLB-E-104",
    "SLB-E-105",
    "SLB-E-106",
    "SLB-E-107",
    "SLB-E-108",
    "SLB-E-109",
    "SLB-E-110",
    "SLB-E-111",
    "SLB-E-112",
    "SLB-E-113",
    "SLB-E-114"
  ],
  "pathway_ids": [
    "SLB-P-001",
    "SLB-P-101"
  ],
  "decision_notes": "Unapproved depth extension. Prior snapshots and inherited evidence deadlines are preserved. Coordinator decisions are not designated human approval.\n\nPrior draft notes are historical. Approved by Lindsey Jones on 2026-10-27 for qualified routine/default Climate-FCV application use. This is release-use approval, not independent verification or certification of claims or sources. Existing uncertainty, source-access limits and individual evidence review deadlines remain in force. See reviews/20261027_global-production-approval-manifest.json."
}
