{
  "iso3": "UZB",
  "country_name": "Uzbekistan",
  "country_aliases": [],
  "status": "draft",
  "reviewer": null,
  "reviewed_on": null,
  "review_due": null,
  "dossier_path": "countries/UZB/candidates/2026.10.26/dossier.md",
  "evidence_ids": [
    "UZB-E-001",
    "UZB-E-002",
    "UZB-E-003",
    "UZB-E-004",
    "UZB-E-005",
    "UZB-E-006",
    "UZB-E-007",
    "UZB-E-008"
  ],
  "pathway_ids": [],
  "decision_notes": "FY27 IDA expansion draft. Primary-source claims and access limitations are recorded in research/20261026_ida_expansion/extractions/. Human review and explicit approval are pending; not eligible for runtime promotion. Record refresh dates are administrative recheck deadlines, not approval dates."
}
