{
  "iso3": "VCT",
  "country_name": "Saint Vincent and the Grenadines",
  "country_aliases": [],
  "status": "draft",
  "reviewer": null,
  "reviewed_on": null,
  "review_due": null,
  "dossier_path": "countries/VCT/candidates/2026.10.26/dossier.md",
  "evidence_ids": [
    "VCT-E-001",
    "VCT-E-002",
    "VCT-E-003",
    "VCT-E-004",
    "VCT-E-005",
    "VCT-E-006"
  ],
  "pathway_ids": [],
  "decision_notes": "FY27 IDA expansion draft. Primary-source claims and access limitations are recorded in research/20261026_ida_expansion/extractions/. Human review and explicit approval are pending; not eligible for runtime promotion. Record refresh dates are administrative recheck deadlines, not approval dates."
}
